{
	"key": "movies",
	"name": "Bluray Movies",

	"types": [
		{ 
			"key":"movie",
			"name": "Movie",
			"attributes": [
				{	"key": "year", "name": "Year", "type": "enum", "units": "", "weight": 10 },
				{	"key": "genre", "name": "Genre", "type": "enum", "units": "", "weight": 9 },
				{	"key": "director",	"name": "Director",	"type": "enum",	"units": "", "weight": 8 },
				{	"key": "aspect_ratio", "name": "Aspect Ratio", "type": "string", "units": "", "weight": 7 },
				{	"key": "run_time", "name": "Run Time", "type": "string", "units": "minutes", "weight": 6 },
				{	"key": "box_office", "name": "Box Office", "type": "currency", "units": "million", "weight": 5 },
				{	"key": "budget", "name": "Budget", "type": "currency", "units": "million", "weight": 4 },
				{	"key": "upc", "name": "UPC", "type": "string", "units": "", "weight": 3 }
			]
		}
	],

	"items": [
		{
			"key": "2010_inception",
			"name": "Inception (2010)",
			"type": "movie",
			"attributes": {
				"year": "2010",
				"genre": "Sci-Fi",
				"director": "Christopher Nolan",
				"box_office": "829.9",
				"budget": "160",
				"upc": "123456789012",
				"aspect_ratio": "2.39:1",
				"run_time": "148"
			}
		},
		{
			"key": "1994_shawshank_redemption",
			"name": "The Shawshank Redemption (1994)",
			"type": "movie",
			"attributes": {
				"year": "1994",
				"genre": "Drama",
				"director": "Frank Darabont",
				"box_office": "",
				"budget": "25",
				"upc": "234567890123",
				"aspect_ratio": "1.85:1",
				"run_time": "142"
			}
		},
		{
			"key": "2008_the_dark_knight",
			"name": "Batman: The Dark Knight(2008)",
			"type": "movie",
			"attributes": {
				"year": "2008",
				"genre": "Action",
				"director": "Christopher Nolan",
				"box_office": "1,004",
				"budget": "185",
				"upc": "345678901234",
				"aspect_ratio": "2.39:1",
				"run_time": "152"
			}
		},
		{
			"key": "1994_pulp_fiction",
			"name": "Pulp Fiction (1994)",
			"type": "movie",
			"attributes": {
				"year": "1994",
				"genre": "Crime",
				"director": "Quentin Tarantino",
				"box_office": "213.9",
				"budget": "8",
				"upc": "456789012345",
				"aspect_ratio": "2.39:1",
				"run_time": "154"
			}
		},
		{
			"key": "1972_the_godfather",
			"name": "The Godfather (1972)",
			"type": "movie",
			"attributes": {
				"year": "1972",
				"genre": "Crime",
				"director": "Francis Ford Coppola",
				"box_office": "250",
				"budget": "6",
				"upc": "567890123456",
				"aspect_ratio": "1.85:1",
				"run_time": "175"
			}
		}
	]
}